### ISSUE TITLE
Connection lost after 10s consistently in any mode, APM Planner, possible routing issue

### ISSUE THREAD

**Issue by kaangoksal** [mavlink-router/mavlink-router#382]
Here is my conf file, nothing complex: 

```bash
pi@ras-pilot:~/mav-telemetry-linux/bin $ cat /etc/mavlink-router/main.conf 

[UartEndpoint usbUART]
Device = /dev/ttyACM0  
Baud = 115200

#[UartEndpoint pinUART]
#Device = /dev/ttyS0
#Baud = 57600

[UdpEndpoint MainUdp]
mode = Server
Address = 0.0.0.0
Port = 14555
```

```bash
pi@ras-pilot:~/mavlink-router/build/src $ ./mavlink-routerd
mavlink-router version v3
Opened UART [4]usbUART: /dev/ttyACM0
UART [4]usbUART: speed = 115200
Opened UDP Server [5]MainUdp: 0.0.0.0:14555
Opened TCP Server [6] [::]:5760
TCP [8]dynamic: Connection accepted
113 messages to unknown endpoints in the last 5 seconds
110 messages to unknown endpoints in the last 5 seconds
111 messages to unknown endpoints in the last 5 seconds
110 messages to unknown endpoints in the last 5 seconds
111 messages to unknown endpoints in the last 5 seconds
110 messages to unknown endpoints in the last 5 seconds
```

I compiled the project on a raspberry pi 4 and also raspberry pi 3. Autopilot is connected with USB, I use apm planner to connect to mavlink router, both devices are on local network. 

I see following messages on apm planner side: 
``` bash

HBD: Heartbeat stopped
Requested retransmission of #595
```

I also started watching the packets using the following command: 

`tcpdump -i wlo1 -n udp port 14555` 

I see that mavlink-router stops sending messages to apm planner shortly after apm planner starts sending messages. 

here is the output of this for tcp  

``` bash
sudo tcpdump -i eth0 -n tcp port 5760


18:59:10.094043 IP 10.0.0.167.57920 > 10.0.0.247.5760: Flags [P.], seq 23752:23888, ack 1, win 501, options [nop,nop,TS val 2511349104 ecr 688518180], length 136
18:59:10.094134 IP 10.0.0.247.5760 > 10.0.0.167.57920: Flags [.], ack 23888, win 500, options [nop,nop,TS val 688518530 ecr 2511349104], length 0
18:59:10.451140 IP 10.0.0.167.57920 > 10.0.0.247.5760: Flags [P.], seq 23888:24024, ack 1, win 501, options [nop,nop,TS val 2511349461 ecr 688518530], length 136
18:59:10.451271 IP 10.0.0.247.5760 > 10.0.0.167.57920: Flags [.], ack 24024, win 500, options [nop,nop,TS val 688518887 ecr 2511349461], length 0
18:59:10.738881 IP 10.0.0.167.57920 > 10.0.0.247.5760: Flags [P.], seq 24024:24045, ack 1, win 501, options [nop,nop,TS val 2511349749 ecr 688518887], length 21
18:59:10.738934 IP 10.0.0.247.5760 > 10.0.0.167.57920: Flags [.], ack 24045, win 500, options [nop,nop,TS val 688519174 ecr 2511349749], length 0
18:59:10.838838 IP 10.0.0.167.57920 > 10.0.0.247.5760: Flags [P.], seq 24045:24181, ack 1, win 501, options [nop,nop,TS val 2511349850 ecr 688519174], length 136
18:59:10.838896 IP 10.0.0.247.5760 > 10.0.0.167.57920: Flags [.], ack 24181, win 500, options [nop,nop,TS val 688519274 ecr 2511349850], length 0
18:59:11.144548 IP 10.0.0.167.57920 > 10.0.0.247.5760: Flags [P.], seq 24181:24317, ack 1, win 501, options [nop,nop,TS val 2511350154 ecr 688519274], length 136
18:59:11.144653 IP 10.0.0.247.5760 > 10.0.0.167.57920: Flags [.], ack 24317, win 500, options [nop,nop,TS val 688519580 ecr 2511350154], length 0
18:59:11.502636 IP 10.0.0.167.57920 > 10.0.0.247.5760: Flags [P.], seq 24317:24453, ack 1, win 501, options [nop,nop,TS val 2511350512 ecr 688519580], length 136
18:59:11.502736 IP 10.0.0.247.5760 > 10.0.0.167.57920: Flags [.], ack 24453, win 500, options [nop,nop,TS val 688519938 ecr 2511350512], length 0
18:59:11.738245 IP 10.0.0.167.57920 > 10.0.0.247.5760: Flags [P.], seq 24453:24474, ack 1, win 501, options [nop,nop,TS val 2511350748 ecr 688519938], length 21
18:59:11.738338 IP 10.0.0.247.5760 > 10.0.0.167.57920: Flags [.], ack 24474, win 500, options [nop,nop,TS val 688520174 ecr 2511350748], length 0
18:59:11.848132 IP 10.0.0.167.57920 > 10.0.0.247.5760: Flags [P.], seq 24474:24610, ack 1, win 501, options [nop,nop,TS val 2511350856 ecr 688520174], length 136
18:59:11.848256 IP 10.0.0.247.5760 > 10.0.0.167.57920: Flags [.], ack 24610, win 500, options [nop,nop,TS val 688520284 ecr 2511350856], length 0

```

as you can see, only data flowing is coming from 10.0.0.167 (apm planner) to 10.0.0.247:5760 (where mavlink-router is running). 

I don't have this problem with mavproxy.py, it seems like mavlink-router is stopping transmission very soon after a connection is established. I have to re-start mavlink-router to just gain 10 seconds of connection.

how should I debug this?

**Comment by kaangoksal** [comment]
I ran the mavlink router in -v mode, and I see this message

```
Message 147 to unknown sysid/compid: -1/-1
> UART [4]usbUART: Got 16 bytes
Endpoint [4]usbUART: got message 11020 to -1/-1 from 1/1
	Known components:
		1/1
Endpoint [5]MainUdp: got message 11020 to -1/-1 from 1/1
	Known components:
		252/1
		1/1
Message 11020 to unknown sysid/compid: -1/-1
> UDP [5]MainUdp: Got 21 bytes
Endpoint [4]usbUART: got message 0 to -1/-1 from 252/1
	Known components:
		1/1
Endpoint [4] accepted message 0 to -1/-1 from 252/1
UART [4]usbUART: Wrote 21 bytes
Endpoint [5]MainUdp: got message 0 to -1/-1 from 252/1
	Known components:
		252/1
		1/1

```

so apm planner seems to be sending the message to -1/-1 instead of 1/1 ?? maybe that is the issue?

**Comment by kaangoksal** [comment]
Here is the fix 
```
[UartEndpoint usbUART]
Device = /dev/ttyACM0  
Baud = 115200
MavlinkDialect = auto
AllowSrcSysIn = 1

[UdpEndpoint MainUdp]
mode = Normal
Address = 10.0.0.167
Port = 14550
AllowSrcSysIn = 252

```


result of the output 

```

Endpoint [5] accepted message 241 to -1/-1 from 1/1
UDP [5]MainUdp: Wrote 32 bytes
Endpoint [4]usbUART: got message 147 to -1/-1 from 1/1
	Known components:
		1/1
Endpoint [5]MainUdp: got message 147 to -1/-1 from 1/1
	Known components:
		252/1
Endpoint [5] accepted message 147 to -1/-1 from 1/1
UDP [5]MainUdp: Wrote 53 bytes
Endpoint [4]usbUART: got message 11020 to -1/-1 from 1/1
	Known components:
		1/1
Endpoint [5]MainUdp: got message 11020 to -1/-1 from 1/1
	Known components:
		252/1
Endpoint [5] accepted message 11020 to -1/-1 from 1/1
UDP [5]MainUdp: Wrote 16 bytes
> UDP [5]MainUdp: Got 21 bytes
Endpoint [4]usbUART: got message 0 to -1/-1 from 252/1
	Known components:
		1/1
Endpoint [4] accepted message 0 to -1/-1 from 252/1
UART [4]usbUART: Wrote 21 bytes
Endpoint [5]MainUdp: got message 0 to -1/-1 from 252/1
	Known components:
		252/1

```


I think there is something funky going on with  sys/comp id matching with mavlink-router.

**Comment by lucasdemarchi** [comment]
```
Endpoint [5]MainUdp: got message 0 to -1/-1 from 252/1
	Known components:
		252/1
		1/1
```

It seems apmplanner is connected to both the TCP and the UDP endpoint, causing a loop between the endpoints.
That is probably because APM planner is listening to that port and when we start mavlink-router we are broadcasting to that port.  Either disable the UDP in APM planner or if there isn't such an option, switch to another port so APM planner doesn't  try to use both endpoints.

**Comment by kaangoksal** [comment]
@lucasdemarchi  

I turned off the udp endpoint 
```
pi@ras-pilot:~/mavlink-router/build/src $ cat /etc/mavlink-router/main.conf 

[UartEndpoint usbUART]
Device = /dev/ttyACM0  
Baud = 115200
MavlinkDialect = auto
#AllowSrcSysIn = 1

#[UartEndpoint pinUART]
#Device = /dev/ttyS0
#Baud = 57600

#[UdpEndpoint MainUdp]
#mode = Normal
#Address = 10.0.0.167
#Port = 14550
#AllowSrcSysIn = 252
pi@ras-pilot:~/mavlink-router/build/src $ 
```




here is the result 

```
Message 168 to unknown sysid/compid: -1/-1
Endpoint [4]usbUART: got message 136 to -1/-1 from 1/1
	Known components:
		1/1
Endpoint [7]dynamic: got message 136 to -1/-1 from 1/1
	Known components:
		252/1
		1/1
Message 136 to unknown sysid/compid: -1/-1
> UART [4]usbUART: Got 61 bytes
Endpoint [4]usbUART: got message 193 to -1/-1 from 1/1
	Known components:
		1/1
Endpoint [7]dynamic: got message 193 to -1/-1 from 1/1
	Known components:
		252/1
		1/1
Message 193 to unknown sysid/compid: -1/-1
Endpoint [4]usbUART: got message 241 to -1/-1 from 1/1
	Known components:
		1/1
Endpoint [7]dynamic: got message 241 to -1/-1 from 1/1
	Known components:
		252/1
		1/1
Message 241 to unknown sysid/compid: -1/-1
> UART [4]usbUART: Got 69 bytes
Endpoint [4]usbUART: got message 147 to -1/-1 from 1/1
	Known components:
		1/1
Endpoint [7]dynamic: got message 147 to -1/-1 from 1/1
	Known components:
		252/1
		1/1
Message 147 to unknown sysid/compid: -1/-1
Endpoint [4]usbUART: got message 11020 to -1/-1 from 1/1
	Known components:
		1/1
Endpoint [7]dynamic: got message 11020 to -1/-1 from 1/1
	Known components:
		252/1
		1/1
Message 11020 to unknown sysid/compid: -1/-1
```

still the same

**Comment by jbeyerstedt** [comment]
Are you sure, that the FMU isn't connected though another link to APM and that APM doesn't forward messages between links? Because it's quite unusual, that the endpoint to APM is receiving messages from 1/1.
You could try to use filters when connecting to APM via an UDP endpoint, but that's not actually solving the cause of the problem.

As mavlink-router rejects to send messages where the source sys ID and component ID matches any of the "known components" on this endpoint to prevent loops, it's bad, if 1/1 is present on all endpoints. System and component ID -1/-1 is used for "broadcast" MAVLink messages (where no target IDs are present). Only some messages have a target address (e.g. parameter request and parameter write) as telemetry is usually broadcast to everybody.

**Comment by kaangoksal** [comment]
so what this error message is saying that, TCP link has two components BEHIND it, 252/1 and 1/1, that would only happen if APM sent a message as 1/1 to the router? 

my setup is pretty simple, just APM Planner in a seperate computer and raspberry pi ---> mateksys ardupilot on the same network.

**Comment by jbeyerstedt** [comment]
Closing because of no activity (and it seems to be fixed on APM side). Feel free to comment and re-open, if there are things left to discuss.
